{
  "schemaVersion": "omk.proof-bundle.v1",
  "proofId": "006-evidence-block",
  "title": "Evidence missing block proof bundle",
  "omkVersion": "1.2.0-rc.0",
  "runtimeVersion": "v1.2",
  "commit": "83cb8bdf5de1",
  "runId": "proof-006-evidence-block-20260531t080818z",
  "providerPolicy": "local verifier fixture; required file-exists gate intentionally absent",
  "scenario": "evidence-block",
  "files": {
    "rawPrompt": "proof/verified-runs/006-evidence-block/raw-prompt.md",
    "commands": "proof/verified-runs/006-evidence-block/commands.sh",
    "verifyJson": "proof/verified-runs/006-evidence-block/verify.json",
    "decisionsJsonl": "proof/verified-runs/006-evidence-block/decisions.jsonl",
    "runManifest": "proof/verified-runs/006-evidence-block/run-manifest.json",
    "evidenceJsonl": "proof/verified-runs/006-evidence-block/evidence.jsonl",
    "limitations": "proof/verified-runs/006-evidence-block/limitations.md",
    "stateJson": "proof/verified-runs/006-evidence-block/state.json",
    "omkVerifyJson": "proof/verified-runs/006-evidence-block/omk-verify.json",
    "omkVerifyStderr": "proof/verified-runs/006-evidence-block/omk-verify.stderr"
  },
  "verdict": "passed",
  "knownLimitations": [
    "Uses a deterministic local run-state fixture rather than a live provider execution.",
    "The proof demonstrates a missing file-exists evidence gate, not every evidence failure kind.",
    "Command output paths are sanitized by replacing the repository root with [repo-root]."
  ],
  "checksums": {
    "proof/verified-runs/006-evidence-block/raw-prompt.md": "fe31baa246b7c503b29117eb8fd5c1617d8febf3349935e88cd233aa679afa73",
    "proof/verified-runs/006-evidence-block/commands.sh": "d55993a515f60f33e094eb8ca8f24fbef38bad4531c7ba7234ebc52ae9c04e85",
    "proof/verified-runs/006-evidence-block/verify.json": "0e87fd81c813309a3b5b68226f639dba16e04f027687966048fcbc7b878201d9",
    "proof/verified-runs/006-evidence-block/decisions.jsonl": "d5c9f1a42e32fdc704d263548bfb33ccd1bb14a2510b96710f0f1507b9ea6ac4",
    "proof/verified-runs/006-evidence-block/run-manifest.json": "f7182bec243142e3be424f96d020bde3ed107e792bbb3100eea1ec1535ba696f",
    "proof/verified-runs/006-evidence-block/evidence.jsonl": "48cfdbcb93187748adead05a54bb2f2b23a9c3c99d1736b86aa7b564a7bac4e4",
    "proof/verified-runs/006-evidence-block/limitations.md": "d76de0b5416fb6add6067ada79978f9c88cef513a344ec5ee3f3200057505545",
    "proof/verified-runs/006-evidence-block/state.json": "cd88469eed5187b7790cb418ae2f517e12cff46c8e559212298f3f93747757ec",
    "proof/verified-runs/006-evidence-block/omk-verify.json": "0b2305312208d82215fa2d7b6cb67bd59f04b03ae809d042f4f553fb0d9d5af7",
    "proof/verified-runs/006-evidence-block/omk-verify.stderr": "7636204a1963c7344d3a0de348069f5fbe7cb96314b133c25116055e4d9e59c0"
  }
}
