{
  "schemaVersion": "omk.proof-bundle.v1",
  "proofId": "007-replay-inspect",
  "title": "Replay and inspect artifact reopening proof bundle",
  "omkVersion": "1.2.0-rc.0",
  "runtimeVersion": "v1.2",
  "commit": "83cb8bdf5de1",
  "runId": "proof-007-replay-inspect-20260531t080818z",
  "providerPolicy": "local replay fixture; no external provider calls",
  "scenario": "replay-inspect",
  "files": {
    "rawPrompt": "proof/verified-runs/007-replay-inspect/raw-prompt.md",
    "commands": "proof/verified-runs/007-replay-inspect/commands.sh",
    "verifyJson": "proof/verified-runs/007-replay-inspect/verify.json",
    "decisionsJsonl": "proof/verified-runs/007-replay-inspect/decisions.jsonl",
    "runManifest": "proof/verified-runs/007-replay-inspect/run-manifest.json",
    "evidenceJsonl": "proof/verified-runs/007-replay-inspect/evidence.jsonl",
    "replay": "proof/verified-runs/007-replay-inspect/replay.json",
    "inspectJson": "proof/verified-runs/007-replay-inspect/inspect.json",
    "limitations": "proof/verified-runs/007-replay-inspect/limitations.md",
    "fixtureRunJson": "proof/verified-runs/007-replay-inspect/run-fixture/run.json",
    "fixtureDagJson": "proof/verified-runs/007-replay-inspect/run-fixture/dag.json",
    "fixtureAttemptsJsonl": "proof/verified-runs/007-replay-inspect/run-fixture/attempts.jsonl",
    "fixtureDecisionsJsonl": "proof/verified-runs/007-replay-inspect/run-fixture/decisions.jsonl",
    "fixtureEvidenceJsonl": "proof/verified-runs/007-replay-inspect/run-fixture/evidence.jsonl",
    "fixtureContextCapsule": "proof/verified-runs/007-replay-inspect/run-fixture/context-capsules/collect-evidence-collect-evidence__1.json",
    "fixturePromptSnapshot": "proof/verified-runs/007-replay-inspect/run-fixture/prompts/collect-evidence-collect-evidence__1.txt",
    "fixtureToolEvents": "proof/verified-runs/007-replay-inspect/run-fixture/tool-events/collect-evidence-collect-evidence__1.jsonl"
  },
  "verdict": "passed",
  "knownLimitations": [
    "Uses a deterministic fixture run rather than a live provider run.",
    "Replay and inspect JSON outputs currently do not use the omk.contract.v1 envelope; this proof wraps the observed outputs in verify.json.",
    "The fixture demonstrates one successful node and one attempt, not multi-node replay branching."
  ],
  "checksums": {
    "proof/verified-runs/007-replay-inspect/raw-prompt.md": "1ff887240389d18e5865aa35ad1670f2e1c062132950a6aa909f1b364d89621b",
    "proof/verified-runs/007-replay-inspect/commands.sh": "50b5af34315d7002ca2d1c425bc9606e8083da222253ccdcaf4bb5bc3d3838e0",
    "proof/verified-runs/007-replay-inspect/verify.json": "0270c14f941a24ca18d9c69812d64b45cdc559c908d6e94488e0da43f443177e",
    "proof/verified-runs/007-replay-inspect/decisions.jsonl": "7d24ecba2c770597075edb8659c8943f92df3941e5c6e71205a0fd845ce8697c",
    "proof/verified-runs/007-replay-inspect/run-manifest.json": "38421f7767849e7e4ac9e278fbae5cf6c4a050834bef43d407284e7b67de102a",
    "proof/verified-runs/007-replay-inspect/evidence.jsonl": "f7d44815275f11f9adc558432fc04e1ce1056e5a41ef612f3d1fbce34cb5317e",
    "proof/verified-runs/007-replay-inspect/replay.json": "54dea9a0f31c0ff668055dc320a43ae61604a143ffc454e42ee01c62ebfbc59e",
    "proof/verified-runs/007-replay-inspect/inspect.json": "e60df854a19281d823aba62d13578193d289a99a67a26c0668392503d365d856",
    "proof/verified-runs/007-replay-inspect/limitations.md": "dff98c027e15dcf6fbfd92cf74fc306a701e5359b5025a7e53d8dc84e7df827e",
    "proof/verified-runs/007-replay-inspect/run-fixture/run.json": "6ac5bbf712e7eaaec1a7aea93eb2a514aafb474aa0cdaf1c41be5d1e11b4e386",
    "proof/verified-runs/007-replay-inspect/run-fixture/dag.json": "a1fd294474d46468b3502137d0af161bd0267eaf55a7d48ca3e022951cac8e41",
    "proof/verified-runs/007-replay-inspect/run-fixture/attempts.jsonl": "5910db0ae22f462fdedfb909576a05a5390b0e707b9256cb67ac1b6ecf34284f",
    "proof/verified-runs/007-replay-inspect/run-fixture/decisions.jsonl": "89a09a64eedf0977113caaecb4512c9cc73c047fa0c0ed243b90b7f350aa97bc",
    "proof/verified-runs/007-replay-inspect/run-fixture/evidence.jsonl": "319d59529660032a531ed9d7d554a77962bd9fbfc09fcfd2b9d6de4dcabd6632",
    "proof/verified-runs/007-replay-inspect/run-fixture/context-capsules/collect-evidence-collect-evidence__1.json": "1813321c156fb4552117cab3aad51895d0f15cdb71342518c1abc1b57e8c1224",
    "proof/verified-runs/007-replay-inspect/run-fixture/prompts/collect-evidence-collect-evidence__1.txt": "9e49aadbeb90723dcb2ce4bca14df1904ed0c55e3cd59b803588832c5e88e6a4",
    "proof/verified-runs/007-replay-inspect/run-fixture/tool-events/collect-evidence-collect-evidence__1.jsonl": "3ee49bb0cf120ef8ea91724faa68613aceb500db1163def76d3057f680173f6d"
  }
}
