{
  "schemaVersion": "omk.proof-bundle.v1",
  "proofId": "003-fallback-route",
  "title": "No-Kimi auto route fallback smoke proof bundle",
  "omkVersion": "1.2.0-rc.0",
  "runtimeVersion": "v1.2",
  "commit": "edb00974291d",
  "runId": "proof-003-fallback-route-20260531t063434z",
  "providerPolicy": "auto provider route; KIMI_BIN=/nonexistent/kimi; MCP preflight off; MCP scope none",
  "scenario": "fallback-route",
  "files": {
    "rawPrompt": "proof/verified-runs/003-fallback-route/raw-prompt.md",
    "commands": "proof/verified-runs/003-fallback-route/commands.sh",
    "command1Stdout": "proof/verified-runs/003-fallback-route/command-1.out",
    "verifyJson": "proof/verified-runs/003-fallback-route/verify.json",
    "decisionsJsonl": "proof/verified-runs/003-fallback-route/decisions.jsonl",
    "runManifest": "proof/verified-runs/003-fallback-route/run-manifest.json",
    "evidenceJsonl": "proof/verified-runs/003-fallback-route/evidence.jsonl",
    "limitations": "proof/verified-runs/003-fallback-route/limitations.md"
  },
  "verdict": "passed",
  "knownLimitations": [
    "This bundle proves only the scoped smoke fallback path, not every provider fallback branch.",
    "The smoke command does not grant merge authority or external API health guarantees.",
    "Output artifacts are sanitized by replacing local paths with [repo-root] or [home]."
  ],
  "checksums": {
    "proof/verified-runs/003-fallback-route/raw-prompt.md": "5ecede52b89a31e070046ee2b62df0dd6b05b9cb19a9801658e3b7aa3eea386a",
    "proof/verified-runs/003-fallback-route/commands.sh": "e3a8c2bad22874ec47566776e8b5201d5f42e676d90386b527bc7f4e43f2bd6c",
    "proof/verified-runs/003-fallback-route/command-1.out": "ce05cdfa3946afa392ae11ea91f245ce495c6f1641cfef33a814cf9e8cd1129a",
    "proof/verified-runs/003-fallback-route/verify.json": "2447232eefddc992729105458fdb6b036ad3600cb18afaf1d4d6b5230f5b61cd",
    "proof/verified-runs/003-fallback-route/decisions.jsonl": "7d798d61f7d8746ec4df60cab603f0243560cb9a1a69b682834638a0997a6e84",
    "proof/verified-runs/003-fallback-route/run-manifest.json": "46755ec84857062ec30416389b561765895cf4f575926b59ba73d80d10e4906f",
    "proof/verified-runs/003-fallback-route/evidence.jsonl": "15aaee188702e9dfd30061c2f5c4e74bfc37f70e1fd5b3d8fa0c170fdf3b44e1",
    "proof/verified-runs/003-fallback-route/limitations.md": "ba1ba9389d349441d655202344c71f5797fc3a03ac0c387ebde8fe06893d7e48"
  }
}
