{
  "schemaVersion": "omk.proof-bundle.v1",
  "proofId": "002-doctor-provider",
  "title": "No-Kimi doctor provider smoke proof bundle",
  "omkVersion": "1.2.0-rc.0",
  "runtimeVersion": "v1.2",
  "commit": "edb00974291d",
  "runId": "proof-002-doctor-provider-20260531t063424z",
  "providerPolicy": "doctor JSON smoke with KIMI_BIN=/nonexistent/kimi and local MCP preflight disabled",
  "scenario": "doctor-provider",
  "files": {
    "rawPrompt": "proof/verified-runs/002-doctor-provider/raw-prompt.md",
    "commands": "proof/verified-runs/002-doctor-provider/commands.sh",
    "command1Stdout": "proof/verified-runs/002-doctor-provider/command-1.out",
    "verifyJson": "proof/verified-runs/002-doctor-provider/verify.json",
    "decisionsJsonl": "proof/verified-runs/002-doctor-provider/decisions.jsonl",
    "runManifest": "proof/verified-runs/002-doctor-provider/run-manifest.json",
    "evidenceJsonl": "proof/verified-runs/002-doctor-provider/evidence.jsonl",
    "limitations": "proof/verified-runs/002-doctor-provider/limitations.md"
  },
  "verdict": "passed",
  "knownLimitations": [
    "This bundle proves the scoped doctor JSON smoke path only.",
    "Provider authentication health is environment-dependent and no credential values are captured.",
    "Output artifacts are sanitized by replacing local paths with [repo-root] or [home]."
  ],
  "checksums": {
    "proof/verified-runs/002-doctor-provider/raw-prompt.md": "52326ef386cfaf8b735836c06c45910bd24f4d6a06b2b79288e8cbe4827d3f5d",
    "proof/verified-runs/002-doctor-provider/commands.sh": "59dc3d09abb0a3b272a5904d11c3f3bc43ac57051b47ff84ca51e0ef74c65f11",
    "proof/verified-runs/002-doctor-provider/command-1.out": "f6465fd0e2cb987666b8b26dfa00f846e14ee38df0790b69fc61af8c4d13e292",
    "proof/verified-runs/002-doctor-provider/verify.json": "1e813b2009d3998ad0dd0dcbfa0ea2233c4468d859d8593fd0bde83d5d624b5c",
    "proof/verified-runs/002-doctor-provider/decisions.jsonl": "0d66e37be8a3afa2d1b10a06c34670f56a63fab7616e0de66d427c100fbcd70b",
    "proof/verified-runs/002-doctor-provider/run-manifest.json": "1f07836a1eb093f9df091f242fa9b054106d2f1af50747bd07754aff295402de",
    "proof/verified-runs/002-doctor-provider/evidence.jsonl": "bb5a52d9cae55efae8713fdf64d209c8555a2e5d6aa91836c2df1e6d9b08da96",
    "proof/verified-runs/002-doctor-provider/limitations.md": "4b4b70a93f9cbe55eef06674cd15936d76e9c1d7f00005afb5043ca42e5b4b2e"
  }
}
